{
  "platforms": [
    "U01",
    "U02",
    "U03",
    "U04"
  ],
  "targets": [
    "G01",
    "G02",
    "G03",
    "G04"
  ],
  "hit_probability": {
    "U01": {
      "G01": 0.485,
      "G02": 0.52,
      "G03": 0.555,
      "G04": 0.59
    },
    "U02": {
      "G01": 0.555,
      "G02": 0.59,
      "G03": 0.625,
      "G04": 0.66
    },
    "U03": {
      "G01": 0.625,
      "G02": 0.66,
      "G03": 0.695,
      "G04": 0.38
    },
    "U04": {
      "G01": 0.695,
      "G02": 0.38,
      "G03": 0.415,
      "G04": 0.45
    }
  },
  "target_value": {
    "G01": 50,
    "G02": 12,
    "G03": 50,
    "G04": 12
  },
  "target_threat_degree": {
    "G01": 12,
    "G02": 48,
    "G03": 12,
    "G04": 48
  },
  "weapon_cost": {
    "U01": 2,
    "U02": 3,
    "U03": 1,
    "U04": 2
  },
  "platform_weapon_capacity": {
    "U01": 2,
    "U02": 2,
    "U03": 2,
    "U04": 3
  },
  "target_max_assigned_weapons": {
    "G01": 3,
    "G02": 2,
    "G03": 3,
    "G04": 2
  },
  "range_feasibility": {
    "U01": {
      "G01": 1,
      "G02": 1,
      "G03": 1,
      "G04": 0
    },
    "U02": {
      "G01": 1,
      "G02": 1,
      "G03": 0,
      "G04": 1
    },
    "U03": {
      "G01": 1,
      "G02": 0,
      "G03": 1,
      "G04": 1
    },
    "U04": {
      "G01": 0,
      "G02": 1,
      "G03": 1,
      "G04": 1
    }
  }
}
